影评内容,情感得分,影评分数,差异
成功的明星电影而非电影，从热搜词条上也可见一斑。总的来说是贾玲个人魅力大于剧作本身。前半段讲女主受到现实打击的时候充满各种经典性别刻板印象的小品，不懂为什么要刻画一堆女学员围着男教练尖叫，不懂为什么要搞什么姐妹阋墙，明明有更妥当的叙述方式但好像编剧习以为常用最偷懒的笑料作为剧情推动，我作为观众感到非常不适。但不可以否认的是看到后半段贾玲脱胎换骨动作敏捷出现在格斗场的时候，还是非常感动，结尾也没有狗血地走向瘦身成功就谈恋爱，而是和曾经的心上人之间来了个人生境遇的对换和比较，然后沉浸在自己的世界，在黑夜中一拳一步地走向未来。万幸万幸，女性个人奋斗的主题还是立住了。,5.0,3.0,2.0
大家对女性导演真的充满了恶意，减肥这个事情阿米尔汗没有宣传过没有上过热搜吗？独独对贾玲这么刻薄。真可悲。,4.944069832390819,5.0,0.05593016760918079
看完想大喊：姐！,3.933811531052014,5.0,1.0661884689479861
本片最大的成功是女主练了拳击后没有跟她的搭子在一起。,3.070934614687946,4.0,0.9290653853120538
很好看！“热辣滚烫有个点，女角色都有缺陷，张小斐婚瘸龉欤李雪勤做小三。但是都轻飘飘过去了，这是过去男人电影里男人才有的待遇。”,4.994066446834346,5.0,0.005933553165654359
电影四星，比李焕英的煽情和共情还是差一些。肯为了梦想，雪藏一年，推掉自己几乎所有的商约，本就是一部励志电影，为什么阿米尔汗可以这么宣传，贾玲就不可以？手动加上一星，为了那些无脑黑。,1.7252723224093787,5.0,3.2747276775906213
《李焕英》破了30亿，答应观众要减肥。可是减肥很痛苦的，不能白减！减肥又费时间，这样就会少上几个综艺赚钱！那就一边减肥一边拍电影一边赚观众的钱吧！拍什么好呢~日本这部电影，刚好可以翻拍！不错。换个概念讲，就是给我40亿~20亿人民币吧，并且教练、营养师等团队都配齐，在一年时间里不用工作上班，只需减肥100斤！我绝对相信我也可以~~说实话，我不讨厌贾玲，只厌烦电影的营销方式。。。说回电影本身，这个剧情在我看来真的很一般，尽管贾玲表现的能吃能睡还懒，讲话无力不自信，但依旧给我一种活的很“饱满”的感觉。还有最后比赛，一直在挨打，最后来个必杀左拳。都报名拳击比赛了，你实战不练啊，只练动作与瘦身。不愧是懂煽情的“喜“剧人。相比起来，张家辉的《激战》优秀多了。剧情60分，另外加15分送给真的瘦了的贾玲。,4.999999999999999,3.0,1.9999999999999991
一个女孩在关系里受尽屈辱历尽心死后，选择以训练自己身体的方式，独自前行，只拥抱了自己的对手。这是被利用被背叛被掠夺的一个普通女人的孤独处境。拥抱的对手是她自己选的，不爱她但尊重她，和她公平较量，技高一筹就把她往死里打的一个人。我们千山万水要的就是这一点公道。我要的，我来选，这就是赢。,4.999999999752525,5.0,2.474749294378853e-10
贾玲赢了，但乐莹没有赢。花一年专心做一件让自己变好的事情，虽然很燃，但本身就很奢侈。贾玲有这个条件，乐莹没有，大多数我们也没有。,4.999484700372779,3.0,1.9994847003727791
拳赛之前的长镜头很燃，一镜到底展现乐莹面对生活重塑的斗志，犹如独行的猛兽，相击的拳套击碎了过去的一切。,4.999980685076034,5.0,1.9314923966007314e-05
她拍这部片子的目的根本不是说她瘦了这个事，是告诉你，无论你这个人活的有多烂、多失败、多差劲，只要你找到一件事，哪怕只是很小的一件事，一直做、专注做、拼了命地做下去，你会赢的，哪怕就一次。,1.4022256920600924,4.0,2.5977743079399076
虽然是改编，结局比日本原版的好太多了。原版女主还原谅了渣男，我无法理解。贾玲这版女主选择了自己走花路，因为她打拳是开启了新人生。,4.999944886351344,5.0,5.511364865640189e-05
很纠结打了3颗星，如果单纯给贾玲，我愿意给5颗星，因为我知道瘦100斤意味着什么，尽管她说这不是一部减肥的电影，但不得不说，人们看到的最大亮点还是她的瘦身成功，她的毅力和努力值得5颗星甚至更多。但单纯从电影的角度来说，不好意思，我真的没办法全然喜欢。从头到尾，我开心的笑了一次，在雷佳音尿尿那个场面，然后我有一次比较动容想哭，就是看到贾玲努力运动的那些画面。这是电影当中相对比较触及我情绪的两个地方，其他的，说实话从开头到结尾，就比较寡淡，我也不喜欢贾玲在电影中的人设，说她烂好人也罢，说她自暴自弃也行，总之她的这个人设转变的太突兀了，人物发展和改变的理由不够充分也不合理，情节设定上来说有点俗套。她想表达每个人都应该爱自己，都要为了自己努力一次，而实际上她只是被逼迫着要证明自己，全程表演的太丧了。,5.0,3.0,2.0
一想到这电影能让这么多小v子破防打一星就想乐，此电影的高度彻底被拔高??,4.668942654491396,5.0,0.33105734550860433
一个比99％都有钱的人，富态胖再怎么减，也没法还原丧人生的感觉，偏偏她还想试图感动我们，再赚一波？（按这票房，以后都翻拍吧，这多舒服啊）,3.943453145999754,2.0,1.943453145999754
男的啊，你们真的是生怕女人变强；女人们，为它们的无知、愚昧、自卑，干杯??,4.998981118141993,5.0,0.0010188818580072478
“在一切结束之后，乐莹没有迎接父母妹妹，没有拥抱闺蜜，也没有和男人和好，亲缘友缘性缘前尘皆散，尽数被抛诸脑后，她独自一个人在黑夜里向前奔跑。一个强大自由的女人就这样诞生了。”,4.99999999996279,5.0,3.7210234893336747e-11
电影，请用电影的方式去赢；演员，也请用演技去赢。如果不是，那等于从来都没有赢。,4.991908195360591,3.0,1.9919081953605913
起大早去看的，只能说减重100斤是这部电影最不值一提的东西,1.0968329083875257,5.0,3.9031670916124743
看的我热血沸腾，最大的感触是乐莹最后终于学会了拒绝，可能只有讨好型人格能懂，乐莹说出那句“我不喜欢吃牛蛙”是多大的勇敢,4.997825313607917,4.0,0.9978253136079172
结局没有获胜和拒绝雷佳音是我最喜欢的部分,4.986464581685929,5.0,0.013535418314070569
真的好奇怪为什么评论区永远有些冲不掉的屎渣见不得人的好,1.5228839393526359,5.0,3.477116060647364
如芒刺背，如鲠在喉，如坐针毡！绝对是春节档最拉垮的一部电影，虽然其它的几部我还没来得及看！,4.2303727968429055,1.0,3.2303727968429055
心疼贾玲，太强了。最有意思的是，影院一个男的看完出来说，“这种我一个月就练出来了”。太经典了，典中点。,4.784559464227305,4.0,0.7845594642273053
支持女的上桌，大上特上，大赚特赚，气死破防的人,1.4211009499292553,4.0,2.5788990500707447
龙年的第一部电影，也是第一次这么早看电影，9点场，只有减过肥的人知道她有多励志多努力，很喜欢结尾的安排，只要想开始一切都来得及，战胜自己就是赢！,4.999885491212609,5.0,0.00011450878739083237
要细究质量的话当然有很多问题，但是我喜欢贾玲。我喜欢看贾玲减肥，我喜欢看贾玲练拳击，我也喜欢结局：不要男人，也没有赢得什么，只是自己开心就好。,4.999999973853161,4.0,0.9999999738531606
客观来说没有那么好，但是我永远为这样的故事落泪，永远为这样的真诚感动。作为一个女性喜剧演员，她不再扮丑不再成为客体化，戏里是自己爬起来说好疼，戏外是找回自己的主体权，角色和自我融为一体的重生，这是多么强烈的生命力啊。敬，我们三年两部如此量级作品的女性创作者。我单纯喜欢看女的打拳。,4.999999999797554,4.0,0.9999999997975539
从去年就开始买各种自媒体说贾玲减肥的消息宣传，真是恶心死了。你为了电影减肥增肥不是太正常了？这不是你的工作吗？至于这么宣传么？？？,1.0452587273473597,1.0,0.045258727347359695
我去，真没想到贾玲成假玲了，如假包换，真诚是真诚，但挺割裂“吓人”的。（1月4日 210斤-11月24日 117斤）没想到终于碰上了一次“货物对版”的院线电影，《热辣滚烫》宣发和电影几近一致了，不过也没想到这辈子减重也可以成为宣发卖点挣到钱。如此推断那张小斐增重至200斤岂不是也会票房大爆。贾玲利用自己的社会形象作为影片卖点和视觉焦点，除了“为了赢一次”的核心命题，更是见证华语电影票房最高的女导演自己的“逆袭”“减重”之旅。很好奇下片后贾玲和宣发会不会提“改编”《百元之恋》的事儿，为什么带引号呢……几乎60%都可以用翻拍来形容。小到人物设定，大到情节拐点，几乎一模一样。强烈建议影迷朋友们顺带一看《百元之恋》，在经典原作与本土改编的互文中看《热辣滚烫》会更有趣味。,4.999983771709751,3.0,1.9999837717097506
除了贾玲真减了100斤令人惊叹，其他都挺无聊的,4.04064330938908,3.0,1.04064330938908
我们需要女导演，需要电影里，女拳手比赛时，不怼着女人大腿拍、不从腿到下体到腰到胸拍到脸的女导演。看到贾玲走向拳击赛场和过去的自己相视而笑，上衣写着That's lihuanying's daughter就流泪了。 永远被她爱妈妈想念妈妈纪念妈妈的心思感动。全片贾玲唯一主动拥抱的人，是那个把她打到牙花眼眶流血的拳击手，那是让她咬牙挨打但也尊重她的对手。 最后，我想朝每一个说贾玲瘦了没以前可爱的人吐一口唾沫。,4.99999999999996,5.0,3.9968028886505635e-14
1.不知道为什么要这么表演，丧不是有气无力也不是虚弱。2.女性学员看拳击比赛也不都是看教练乏善可陈的肌肉。3.内核的自我实现还是为了打别人脸也太陈腐…,4.906783002338104,2.0,2.906783002338104
失败的电影，成功的贾玲,4.70303271040778,3.0,1.70303271040778
丑化除主角外的所有女角色、甚至连一个健身房的女路人都不放过，还讲什么女性力？可惜现实只有在吃不干净的烧烤店月薪两千五房租八百何谈三百块一节的私教课。还不如专注拍《贾玲传》，展现一下资产阶级的全方位减肥法。,4.9999998843469164,1.0,3.9999998843469164
做电影真不容易，刚看完片子，一堆人这么努力，花这么长时间拍了一个这么燃这么难的片子，从摄影到细节都特别棒。结果过来看看豆瓣的戾气，真的恶心，很多人在这里藏在文字背后散播这自己的恶，见不得别人好，见不得别人比你努力，这个豆瓣的平台，没有鼓励，这才是电影人的悲哀。,4.99999998385299,5.0,1.614700995133944e-08
电影拍得很好，但就是完全共情不了。一个做烧烤店服务员的，怎么就突然付的起一节300多的私教课，还有那么多时间打拳了，平时得熬夜，白天都不够睡，时间和钱，多得明明都像富二代了,4.1832851810646305,3.0,1.1832851810646305
黏腻恶俗，《百元之恋》的丧燃绝计拍不出来，只是又一碗符合春节档调性的汉化励志鸡汤小品，荧幕跨界首秀便被抬到不属于她的高度，顶着全球票房最高女导演光环，贾玲的第二部作品露怯是必然的，《李焕英》的亲情牌好歹戳中了多数国人的内心软肋，这次拿减肥一百斤当卖点铺天盖地营销博取流量只会招致反感，也恰巧是片方不自信的表现，上映前广而告之却遮遮掩掩宣而不发，观众花钱买票的初衷不是冲着电影本身质量，而只是为了满足事先被吊起的好奇心想要一睹瘦身后的庐山真面目，不得不说是整个市场环境的悲哀，比起笨拙真诚的业余创作者，精明鸡贼的投机商人更适合贾玲。,4.999999872752362,2.0,2.999999872752362
改编很好。大过年的，一不想看女主被强奸，二不想看女主和挫男复合。,4.93576626065814,5.0,0.06423373934186039
本想看看这片为啥能让这么多男的破防，结果前半部分看得非常不适，各种庸俗性别刻板印象传统恶毒女配全都齐活了，开场就是闺蜜抢男友白烂桥段、姐妹撕破脸揭发出轨孩子非婚生、健身房一堆女性围着教练尖叫扭捏、表妹为事业设套恶意利用……熬到后半段打拳，突然好看起来（怪不得真・打拳健身的女性朋友都跟我说好）。毕竟减掉100斤挥拳飒起来一镜到底就是热血啊，虽然分镜太多照搬原版对看过的观众来说削弱了惊喜，但和现实交织在一起简直是大型励志纪录片（原版并没有减100斤这么抓马，不过练过的人看一眼动作就知道含金量），属于用生命创作了，花絮和结尾电影院已经亮灯但没有一个观众走掉，甚至感觉比正片好看，衬得电影前半段简直和赘婿小视频差不多（当初对我爱理不理现在你们高攀不起）。大过年的，让贾玲来当回龙傲天又有何不可呢，她值！,4.99999999706248,3.0,1.9999999970624804
真的烂，只能靠营销推起来的电影，获得高票房，华语电影之所以越来越烂就是因为有这种电影存在，他们可以对电影什么都不会，而只靠营销就能有有高票房，大家相继效仿。现在营销评分是8分，难以想象后面真实的评分会有多低，明年还会不会有人为贾玲的这种套路买单,4.268113056119308,1.0,3.268113056119308
贾导演打得一手好牌，电影卖座当然好，不卖座，减肥成功也好。,4.995279543521033,3.0,1.9952795435210327
减肥的过程我看到了，但是我没看到电影。,4.881246280874451,2.0,2.881246280874451
贾玲是当年包贝尔那场婚礼上唯一一个救下柳岩的人。我只想说 女性永远处于弱势 我将无条件偏爱女导演。,4.998155408735898,5.0,0.001844591264101858
无语死了，上午第一场还没放完就有无数锁主页的人给热辣刷一星。各种人身攻击说贾玲飞珠的，说减了肥皮都松了的，还有一堆一边给热辣一星一边给另一部五星的，也不知道怎么做到一个小时看两部的，不会真觉得这会儿压别人一头就稳了吧。真的太臭了，臭不可闻。,1.000050560872281,4.0,2.999949439127719
不是为了变瘦，不是为了变美，而是为了变强,4.9573917764747435,5.0,0.042608223525256506
前一个小时真的是太过烂俗了，作为经历过这一切的人，并没有太打动我，但是应该会有很多的胖姑娘因这部影片走入健身房/接触拳击运动吧？那就足够了，大部分人是没有勇气杀死曾经的自己的，在陷入“绝境”之后如果没有极强的外力支持（尤其是金钱），大多便就此沉沦了。观影过程中给拳协的学长、18年带我减肥的教练发消息，感谢他们。教练回复说：“被自己感动啦??？”，其实心情并没有太大的起伏，当时的一切已经成为人生的可贵回忆，我也迈步向前去了。但李玫瑾教授说的可真对，运动能使人获得对自己身体的掌握，继而一点点获得对生活乃至人生的掌控。,4.999999999999653,3.0,1.9999999999996527
拒绝雷佳音的一刻我决定打十分,4.606145226481745,5.0,0.39385477351825493
这也能有7.9的评分，在座各位都有责任。,1.8430854032315893,2.0,0.15691459676841069
花钱去电影院看贾玲送自己一朵小红花…,2.090213921805253,2.0,0.0902139218052529
虽然前三分之二的本土化难看得一塌糊涂，但是不得不承认它有一个比原版更进步的结尾；虽然贾玲是不是个好导演真的很值得商榷，并且用几十个亿的生意来让观众看你自己自我实现这种行为也值得细想，但不得不承认作为演员的贾玲还是很有魅力。虽然说了这么多，还是打两星。,4.999987489297533,2.0,2.999987489297533
《芭比》：女性不该被定义，女性有无限可能，她可以选择伟大或普通，她有选择的权利！《热辣滚烫》：我在家啃老十年，上班第一个月预支好几个月工资，花着老妈辛辛苦苦挣的钱去学拳击，我身边的女性都是小三、花痴、心机婊，就因为最后跟渣男分手了，而且导演是女性，所以，牛逼！女性独立了！天呐，别给女性主义泼脏水了。一个有极其有热度的题材+勉强及格的作品+最顶级的营销=春节档票房冠军。资本已经知道公式了，可能我们以后只配看到这种电影了。,4.999999964967808,3.0,1.9999999649678077
粗制滥造，营销话题，男女对立，拿下这么高票房简直是中国影史的耻辱,4.829824293225919,1.0,3.8298242932259194
在踩女性导演女性主题的时候男的永远这么团结 虎扑打1分给全男性电影打9.7什么精虫思想我不说 怎么了是因为电影主角打拳不是因为男的 是电影里的男的超级废物让你们破防了么,4.995931503989285,5.0,0.00406849601071535
3.5，观感同《八角笼中》，剧作和审美其实跟佳作差着好几档，纯靠导演的认真扳回一城。几乎无力招架连篇累牍的厌女桥段和恶臭郭楠（我们当然知道导演试图反击这一切，但所有笑料都是建立在自我贬损的基础上），但第三幕忽然重现了李焕英式的绝杀，用真心，下死力。当过往所有的尊严散落一地，沉默的坚持换来的还是被无限痛击，《百元之恋》的身体性被再次唤醒，只有疼痛提醒我们还活着。贾玲足以让春节档其他男导演自惭形秽。,4.99999999999994,3.0,1.9999999999999396
贾玲可能不懂电影，但绝对懂中国市场,4.8750020033536074,1.0,3.8750020033536074
远远超出预期，国内男导演都该学学怎么把女角色拍成个人。结尾乐莹一个人往前跑时，我觉得超越了日版，不需要男人，不需要被别人爱，她爱自己，她很自由。另，贾玲减肥100斤的噱头吸引了很多妈妈爸爸辈的人想看这部电影，我觉得特别好，好片子需要有效的商业营销。,4.999999999982855,5.0,1.7145396213891217e-11
平时看电影最容易走神的桥段就是小人物逆袭蒙太奇，无论是埋头狂刷试卷考清北还是丑鬼减肥造型大翻身变美人，横竖都是假的，加了科技的，全靠观众自我说服“我就当ta成功了吧”。所以看到贾玲用这么笨的办法，这么大的代价拍了商业片里最烂俗的五分钟我真的，心跳加速，她虽然不是专业电影人出身，但颇有电影发展早期那种硬桥硬马搏命一拼只为圆梦的癫狂精神，就冲这五分钟可以原谅整个电影的种种不完美,4.999999999888749,4.0,0.9999999998887494
很奇妙的效果。贾玲导演的眼睛似乎能看穿演员表演形象中不肯轻易袒露的真实人格，并在极度戏剧化的情境中转化作最朴素日常的一瞬。情节的减法做得极好，凸显了扑面而来的影像能量。男主角的半路退出让整部影片走入了截然不同的轨道，作为演员的贾玲对抗的不是体重，而是孤独。都说瘦下来的她变了，其实她丝毫未变，只是我们看她的眼光变了。与《喜剧之王》相似的情感内核，极度真诚，但从不自诩真诚。,4.999999999999997,4.0,0.9999999999999973
减肥励志片儿啊我的妈，比贾玲瘦了更让人惊叹的，是她甚至还练了一身腱子肉，牛哇牛哇,4.9998244565977,4.0,0.9998244565977004
这么烂的片子竟然还容不得一点批评，我只能说咱们的电影艺术真的完蛋了,1.699461215997491,1.0,0.6994612159974909
你能拍个什么电影？你拍出来的能叫电影吗？真的，作为谐星，我从来没有觉得你好笑过。当然在污浊的中国娱乐市场你这种人去拍电影捞钱再正常不过了。李焕英就已经够拉垮拉低中国电影市场的标准了。这次又来个更狠的！你真特么恶心，丢人,2.4656889306684433,1.0,1.4656889306684433
为女性视角投票 “当他们还在讨论胖瘦讨喜，她的灵魂已经翻山越岭”,4.997980260110078,5.0,0.002019739889922434
看完有点失望，理解大家被真诚打动，这个8分得有2分是给100斤的，但电影真的一般,1.7574088668290044,3.0,1.2425911331709956
故事普通/俗套。但健身房老板和教练看了肯定特开心，目测年后办卡人数会激增。拍摄手法都很常规，剪辑有一点小心思但不多。滥用背景音乐要扣不少分，也反映了情绪调动和人物塑造都比较差。对贾玲我的感情还挺复杂。她的近两部作品都没有打动我，总让我感觉有自恋的气息。客观来说，一年掉50kg确实很了不起，她也将这作为最主要卖点。上一部宣发的重点是纪念妈妈、歌颂母爱。中规中矩的春节档院线电影，加上这样的卖点至少是不愁票房的。但总拿自己作为重点，不免让我猜测是否自我意识过剩。希望下一部能用视听手法完成真正的电影，而不是MV连播；把故事讲得更有意思，而不是专注在将他人的故事移植和本土化。,5.0,3.0,2.0
我现在在影院，看到了 1 小时 20 分钟，我如坐针毡、如芒刺背、如鲠在喉……尴尬低级的笑点、唯唯诺诺的表演（不是原作精髓丧）、拖拖拉拉的节奏、生硬突兀的转折……也许后面转折时候还挺燃挺励志，但剧作水平是真的最多 3 星，评分过誉了！！！垃圾市场培养垃圾烂片！！！,1.0082194423076163,2.0,0.9917805576923837
建议看原版，省钱省心省事。,1.9595643440197241,1.0,0.9595643440197241
剧情基本靠抄，矛盾基本靠编，感情基本靠煽，演技基本靠瘫，身价几十亿的贾玲对下层阶级的状态充满了自以为是的臆想。从镜头到配乐到彩蛋，与其说是电影，不如说是一场彻彻底底的减肥综艺真人秀。台上都是主义，台下全是生意，喜欢的观众收获了感动，励志的贾玲收获了金钱，至于月入二千五的服务员们，至于生活在真正生活里而不是电影作秀里的诸多女性们，她们的困境与梦想，一场电影过后，谁真的在乎呢。,4.999999999998231,2.0,2.9999999999982307
电影里有很多肉麻的东西，很多过犹不及的煽情。剧作全是直给，小品式的桥段和转折。但就是贾玲的电影贵在情绪都特别满并且情绪很真诚。个人觉得她和吴京都算作者型导演。他们拍的东西再肉麻，但他们自己认。,4.999995758742195,4.0,0.9999957587421946
这片子能7.9 在座的各位都有责任,2.225451573788067,1.0,1.225451573788067
第一贾玲说话有气无力的听着难受，第二电影煽情片段过多，第三真的很像减肥纪录片,4.999660293596201,3.0,1.9996602935962011
天知道里面多少细节是女生才能get到的，那看心情才给的苹果，那句改天吧…男导演镜头里的逆袭也许是把对手摁在地上摩擦叫爸爸，但是女导演镜头里的逆袭可以是输掉一场比赛温柔地婉拒渣男，再温柔地告诉你倒下的我都经历了什么不足为道的委屈。贾玲真的真的好可爱啊！唉…希望新的一年，我们都学会更爱自己,4.999960886192876,5.0,3.9113807123847266e-05
从今天起，贾玲是我最喜欢的华语女明星。出电影院听到有人说“有什么了不起，如果给我那么多投资那么牛的健身团队还可以挣票房，我也可以” 我想说你不可以，首先你不好笑，其次你不是家喻户晓的人、你没有首部编导主演电影54亿票房的成绩、更没有200公斤的体重，所以你才坐在下面看她的电影…希望每个人都有自己的梦想可以说“我能打完”。真心祝贺并赞美她??,4.999577566663908,5.0,0.0004224333360918209
人确实是狠人，片子确实是烂片。,3.9557958147191314,2.0,1.9557958147191314
这电影幕后纪录片要比电影本身更有观赏价值。一个女人的野望比一个废物的觉醒更有意思。比较日本拳击题材电影，运动除了是改变自己、迎接挑战、为了赢一次这种口号外，他们还发现运动其实是用来逃避、遗忘、不面对人生困境的一种选择，运动把人纳入机械化的轨道，你不必多想，每次付出总有盈余，总归不会辜负自己。运动是安全屋，用来藏的。至于每个人不敢面对的核心困境是何物，就是一个好电影的二番了。很多中国电影都属于一番电影，人物的轨迹都是被策划好的，一点嚼头都没有，当一个所谓的目的达成，这个人物也就可以去死了。,5.0,2.0,3.0
影片里的各种笑点应不暇接，尤其是乐莹那段在家里睡觉，用脚关电视和闭眼换姿势，完全就是我本人。,2.7089987617492985,5.0,2.2910012382507015
很多人说先不谈电影本身，电影不谈本身的话，谈什么？真够可笑的……,1.7211154381695786,2.0,0.27888456183042143
