影评内容,情感得分,影评分数,差异
徐克太难了，本来三个人写命题作文，写一半就剩自己了，只能卖弄一下招牌慢镜头和调度很酷炫的运镜。片尾那段报人数确实很感动，一个一个报到第七连很有泪点，但我在片尾曲放人名的时候在第一个“联合导演”里看到有个叫“秦天柱”的人，然后就有点想笑，泪点就这样被偷走了。,4.5425205691312875,3.0,1.5425205691312875
这一部的视角收窄，时间过长，相较于《狙击手》，略逊一筹,4.250199178690016,3.0,1.250199178690016
上下部合起来就完整了 中间就猜到只有伍万里幸存 整体不错 战争场面很扎实 没有过度煽情 上部一路顺风 主角光环 下部困难重重 举步维艰 结尾起音乐有点仓促 致敬保家卫国的战士们 希望中国能拍出更多优秀的战争片,4.999999999091363,4.0,0.9999999990913633
必须致敬！此战用1.0版本对抗3.0版本的殊死血战，打出一个二战以来相对和平的地缘政治，持续了五代的国际地位与发展空间。,4.9998801981693255,4.0,0.9998801981693255
徐克的“独自上场”，令时长虽未减去多少却大幅提升观感的下集，成了最符合大档期需求的动作类型片，很多上集里被单纯渲染为狂轰滥炸的场面都被注入“有趣”的设计，无用但必需的文戏也成了头尾的装点，更为凸出战斗转场的层次感与刺激点的连续。,4.999915907667411,3.0,1.9999159076674111
【??】虽然从第一幕飞机扫射而过的镜头就让人皱眉了，但感谢徐克增添的趣味性，tank碾人拍的很美，我就当是娄公子某片的写实拍摄了。,4.999559420231905,1.0,3.999559420231905
七连很是威武。前辈的牺牲，我们时刻牢记,4.7101799506790965,4.0,0.7101799506790965
水门桥不愧是你yyds伍万里好棒,4.994522499756909,5.0,0.005477500243091349
比上部好看点，战争从来都没有赢家。,4.805774610849368,4.0,0.805774610849368
大初一的看这个哭的缓不过来啊,3.743101031399529,3.0,0.743101031399529
宽容的都给长津湖第一部了，所以这一部实在是无法再宽容，全片无法共情，为了打仗的打仗，所有的战争画面如果移到其他战争上也不突兀,4.977907615704369,2.0,2.9779076157043693
这部如果单独看，几乎从头打到尾，虽然结尾有一点文戏。如果和上一部结合在一起当一部看（当然，本来就是完整的一部，但就是给剪成了两部），三位导演（陈凯歌林超贤徐克）个人风格从镜头语言、场面调度来看太明显了，所以整部影片风格又不大统一，有割裂感。看有人说上下部本质是拼盘电影。徐克这次玩的很嗨，但是否部分地方有些过火。梅雪风：最后当伍千里的尸身都保不住被美军的火筒烧焦顺着山坡向下滑去时，一种无关国愁家恨的本质性的悲伤逸出银幕。而这时美军士兵停止发射向长官请示是影片中对于人性最微妙的表达：面对敌军的尸首他有一种本能的尊敬和悲悯这个镜头和前面伍万里满脸嫌恶却不忍地看着美军伤员然后将裹在自己身上的棉被盖在了这个发抖的伤兵身上的镜头异曲同工：在褪去所有的意识形态符号之后战争本质是人与人之间对于身体的互相戕害,5.0,3.0,2.0
比上部战争戏多了不少，但中间还是有些地方令人迷惑。,4.829141597676359,3.0,1.829141597676359
展现志愿军英勇无畏的战斗精神，以快节奏推进着“进攻下碣隅里”“抢占美军机场”两场战斗，与战士们一同置身于巨大危机下，从而制造了悬念与紧张感，也是长津湖战役中最艰苦、也最惋惜的战斗，现英雄角色壮烈牺牲的崇高感，为志愿军战士精神。,5.0,5.0,0.0
不如第一部 少的可怜的文戏让整部电影像cod一样只是突突突,3.640969262080901,3.0,0.6409692620809011
别的不说 配音太烂了 无意义的慢镜头太多 根本不是个用心之作,1.014454589376197,3.0,1.985545410623803
看1的时候，一直在心惊胆战，生怕下一秒就发刀子……原来刀子都攒在了第二部??   剧情是有不合逻辑之处，但没关系，部分情况下，我可以服从于情感。,4.927226244024318,5.0,0.07277375597568181
水门桥雪夜行军没有打不死的英雄挺感人的,4.9779979474669,4.0,0.9779979474668998
with cy 武戏太长且多，看得走神了,2.48904489761965,3.0,0.51095510238035
跟前作一摸一样的感觉。。,1.5563209525277037,3.0,1.4436790474722963
如果觉得故事单薄，就去看第一部。如果觉得人物不丰满，就去看第一部。如果觉得动机模糊，就去看第一部。作为续集真的是完美的答卷（排除所有的静止镜头）。谁说我们没有英雄主义，我们每一个人都是历史的答案。,4.99961518964015,4.0,0.9996151896401502
第二部太好哭了，新中国万岁,4.489620258026506,5.0,0.5103797419734937
1.很一般的动作片，算不上战争片，不如上部长津湖。2.剧情拖沓冗长，缺少吸引力，缺乏新意和亮点，看了两次时间，怎么还不结束。3.和徐老怪的智取威虎山风格雷同，还不如威虎山好看。4.过度煽情，包括音乐和片尾曲，好的电影润物细无声，不是填鸭式。5.美军基本是工具人，人物刻画差老谋子狙击手太多。6.国产战争片还是集结号金陵十三钗南京南京中的战争片段和八百。,4.999999973347506,3.0,1.9999999733475056
对主旋律片开始逆反了，特效堆叠流量加持剧情线弱，还乱改历史的改动...真受不了黄金档全是一些主旋律电影,4.886180861324648,2.0,2.8861808613246476
5/10。还是被故事感动到了，但是题材的事，和电影关系没那么大。这部《水门桥》其实和《长津湖》的观感差不多，不过这部确实徐克的风格浓了些，那种升格、定场的漫画感一看就是出自他的手笔。这种尝试不能说完全不好，只是稍微有点跳戏了。这部的动作戏相较前作也没那么精彩了，虽然还是轰轰轰、砰砰砰、哒哒哒、噗呲噗呲了两个多小时，但整体看下来就真的只有累的感受了，没发现什么特别亮眼的调度和设计。而且和第一部相比，像雷公这种有亮点的角色也没了，本来以为谈子为能抗起来大旗，结果这么草率地给我领盒饭了……制作水平确实是有，可奈何电影规模更大，整体来看，还是扛不起来整部电影。华语战争大片继续加油吧！PS：血腥程度令人咋舌。,4.999999999928042,2.0,2.9999999999280416
剧情安排比1要好不少，不过真・画蛇添足：反派死于话多真是太差了，不如直接冲下来就炸了，还有万里永远都死不了也太差了，你要不就别安排他被冻一晚上，要不就冻死他#多少士兵是在快要被冻死时烧死的,1.0000005851073737,3.0,1.9999994148926263
太失望了,1.316286168230441,2.0,0.683713831769559
太好看了比长津湖更好看！想再看一遍！,4.865211359141486,5.0,0.13478864085851416
比上一部好。“实到一人”时，热泪盈眶。,4.606869383703803,5.0,0.3931306162961974
先辈们的用生命守护了国门，向他们致敬,4.99188459661006,4.0,0.9918845966100598
刚开始看：这片子水平还是不错的，有三星的水平。比第一部流畅很多，风格统一，细节到位，意识到了文戏不足就少拍文戏多拍打戏，战场的残忍尺度也比第一部更大。虽然整体仍是差不多的跌宕起伏和主旋律煽情，但胜在完成度高…调度、演员、剧本巴拉巴拉看完后：“第七穿插连应到一百五十七人，实到一人。”满脑子的评论，最后就只记得了千玺看到大部队向他们敬礼时，无言滑下的那一滴泪。,4.999999999969462,3.0,1.9999999999694618
感觉水门桥的节奏感没有长津湖好。很燃很感动，这种片子其实总能看出一丝反战意味。,4.996543679478695,4.0,0.9965436794786946
有点冗长,2.3333333333333335,3.0,0.6666666666666665
热血男儿离故乡，冰天雪地端步枪。以弱胜强炸大桥，逼走美军保家乡。,4.994785756505896,3.0,1.9947857565058964
写得不对啊，我看了个啥？我怎么感觉有点个人英雄主义？制作组怕不是混进去个美国人？不主旋律啊…本来感情线应该是全连哥哥和弟弟之间的情谊，结果变成为了完成任务牺牲自己。设定是在的，就是没写出来是怎么回事…策略线很清晰，最满意的角色是那个留下手刃了好多战士的美国士兵。从结果来说，是一场失败的战斗，但是要怎么写呢，写出来的都是遗憾…,4.999977507235492,3.0,1.9999775072354922
比第一部好，但是有些偏离历史了，水门桥战役之惨烈还是要看历史才能感知到，致敬先辈英雄们??,4.999999707152042,3.0,1.9999997071520417
补标，2022年观影,4.406778339210804,3.0,1.4067783392108044
为志愿军战士加一星。,3.12442530882588,4.0,0.87557469117412
The definition of SHIT.,2.153571464530795,1.0,1.153571464530795
比第一部好一点吧，中段“二炸水门桥”拍得挺好的，整部电影的色彩也终于和谐了好多。,4.961365254357,3.0,1.9613652543570002
牛13，粗略翻了几十页短评，没见到一条低于4星的，豆瓣算是被控得明明白白了。犹记那年《百鸟朝凤》的制片人下跪求排片，我还骂过这人无赖，这不是道德绑架院线么？现在想想当时还是太年轻，人家不比有zb护航的可以直接威胁影院，噫吁剑可悲也已！,2.634494669361429,1.0,1.634494669361429
大制作,3.8649332496685815,3.0,0.8649332496685815
续作场面依然足够,4.854024809554383,3.0,1.8540248095543834
第一部稍微好点,1.9661106983700964,3.0,1.0338893016299036
徐克独立执导的这部水准严重下降，出现了个人英雄片的苗头。片中美军脸谱化严重，最后被强行降智，沦为工具人。伍万里这个角色真的太令人讨厌了，什么都不懂，还不服从命令。整天一副别人都欠他钱的表情，凭什么大伙都得围着他转，最后偏偏就他一个人幸存了。本片的化妆着实不错，尤其是志愿军战士的战损妆，很真实，比那些只会开美颜的片子强多了。,4.999993209930313,2.0,2.999993209930313
战争场面可以，在大屏幕看应该很过瘾。这种拍摄手法似乎适用于大多数战争片。也就是说，不看上部，上来就开打，也行。,4.9980830341057345,3.0,1.9980830341057345
整体看完感觉还行吧～前面没有太强烈的热血沸腾的感觉，战争太惨烈了。就是最后伍万里报告的时候，给我整破防了…..,4.998396884645235,4.0,0.9983968846452349
比长城更加坚固的是中国军人用血肉铸造的钢铁城墙！在水门桥上的七连和九连的战士根本就没有想过回头……第一部的时候没有掉眼泪，但第二部还是忍不住哭了。中间的泪点有点多啊！什么特别好？是你们特别好啊TAT,4.999755074152011,5.0,0.00024492584798885275
最后只剩一个不听话的战士？…这,4.642643846582468,2.0,2.6426438465824678
还是不错的,4.532061270031953,4.0,0.5320612700319529
刚出来，本来想说这不还好，眼泪忍住了，结果最后还是没成功。报人数时从一连开始一个个数时其实都很清楚到七连时会发生什么但还是忍不住了…印象最深刻的还有那句“新中国万岁”，说完这句话后战士们奔向各自的战场，去迎接各自的结局…,4.999954058724565,5.0,4.594127543455784e-05
比第一部叙事要好，可还是乱轰乱炸，场面血腥，让俺一度脸盲。另外，我妈在旁边看的泪流满面，我爸呼呼大睡,4.972421533719782,3.0,1.972421533719782
韩东君被坦克反复碾压的时候，我的心也被碾压了这个电影拍成系列了，不错,4.9989791233882634,4.0,0.9989791233882634
伟大的中国人民志愿军万岁，伟大的新中国万岁,4.808958721003597,5.0,0.1910412789964031
比长津湖1好看点，1压根没耐性看下去，只想拉进度条。,2.1196559831639368,3.0,0.8803440168360632
做为电影本体很一般是事实，但是情感上给我造成了巨大的振动和感动也是事实！为什么电视剧质感这么强烈？为什么第一次攻桥睡意这么强烈？掌声是献给志愿军战士的，做为电影本体实在很一般。只有爆炸和煽情，这也不是电影啊？这是另一种东西。几个印象深刻的记忆点：瞎子朱亚文、平河、哥哥用身躯护送弟弟最后一程。,4.999999990044609,3.0,1.9999999900446088
就，一般,3.104931127231233,3.0,0.10493112723123321
他们是最可爱的人。,4.42829092442253,5.0,0.5717090755774699
比上部好看许多。总算称得上一部完整的电影。比起战争史诗，影片更靠近个体与一场战斗故事。七连众人都迎来结局。其中算出彩一点的数韩东君的平河。比其他几位老油子总多点纯粹味道。最喜欢最后万里倚在哥哥的遗体旁也冻成冰塑，兄弟俩在喷火器烤炙下随融水漂走，千里燃烬，万里苏醒的设计。,4.999999999956659,4.0,0.9999999999566587
打戏太多了，全都是战争场面，而且感觉每个人的死都是为了死而去死，有点缺乏文戏，伍万里的成长体现的不是太充分,4.9232394358546845,4.0,0.9232394358546845
They are from everywhere,3.0,4.0,1.0
真实的战争比电影里还要残酷，向先烈们致敬！看着如今我们的歼20，想象当年志愿军在雪山沟壑中被美军战机当老鼠一样清扫，心中无限遗憾。,4.99999828621633,4.0,0.9999982862163304
最后的主角光环，和炸桥方式不适合这样的片子。其他都还好。先辈用生命换来的和平，让我们才可以在这上网，看电影，平静的生活。可依然有些人被洗脑式的以反战为名在反对这场伟大的保家卫国战争。人民英雄永垂不朽！中国人民志愿军永垂不朽！,4.999999982539252,4.0,0.9999999825392516
片子不说，我们的军队绝对是一流军队。致敬，看的他们两个从山上下来，在坦克下真的感动泪目,4.999985764406613,4.0,0.9999857644066132
长津湖续集，更加震撼,4.421669696181585,5.0,0.5783303038184151
终于知道哪儿看起来不舒服了：太精致，明显不符合战争时代的精致，台词精致、肢体语言精致、人和人的互动精致，场景特效精致…一切都那么完美，可战争不需要这些浮华的装饰，一场酣畅淋漓的战斗就足以震撼人心了不是么？不知道为啥之前觉得长津湖1还蛮不错的。ps：吴京真的成了一个符号，演戏不是演戏，就是单纯的一个模版。（“第七穿插连，应到157人，实到1人”还是哭了，?1??）,4.99999999971837,3.0,1.9999999997183702
三炸三修，何其悲壮。新中国万岁！,4.189578852922766,5.0,0.8104211470772338
整体还可以，人物很鲜明。,4.786175390329639,4.0,0.7861753903296389
在我心里，没有一部电影可以拍好朝鲜战争。电影一方面太浓墨重彩，一方面又太过苍白，不论如何都很难重现70年前那些轻描淡写又重如泰山的牺牲。看到某些场面可能想说太夸张啦！但曾经有比这更夸张的；有些场面想说太单调了，但现实比这些还要苍白。但不管怎么说，都还是庆幸有这些描写朝鲜战争的片子，至少他们可以提醒一代又一代的中华儿女铭记这段艰难的时光。,4.999999999975145,4.0,0.9999999999751452
7.0,3.0,4.0,1.0
打得我看懵了，几次分不清敌我，结尾有点多余，叫那一声但吴京别出现最好了我不过去拍一次没完成的任务，也算有意义,4.767138394624297,3.0,1.767138394624297
第一次有了反战视角。非常好。,4.608120865692227,4.0,0.6081208656922268
这么好的题材，战争场面应该让人血脉喷张，结果看着却觉得很乱，部分场景甚至都看出武侠剧的感觉了,4.435006266199434,3.0,1.4350062661994336
题材没啥说的，这样的电影越多越好，让年轻一代更懂得现在生活的来之不易，更了解前辈们为了我们做出了多大的牺牲。单从影片本身来看，确实跟第一部比都有很大的差距。这个差距不在演员身上，演员演技都很不错。问题出现在导演和剪辑上，有太多的场景及慢镜头，仅仅是为了体现出悲壮场景，结果连影片都变得不连贯了。还有一些为了表现友情、亲情长时间的脸部特写，实在是太刻意了。相对第一部来说对于本片质量挺失望的。,4.999999999999728,3.0,1.9999999999997282
军歌应唱大刀环，誓灭胡奴出玉关。只解沙场为国死，何须马革裹尸还。,3.885378069773417,5.0,1.114621930226583
跟《长津湖》一样的中式“战狼”式爱国爆米花战争片，相对来说，确实符合国人的口味（国人好像特别喜欢战争片，不知道是不是从小看《大决战》、《血战台儿庄》和各种抗日片有关）。不过相对来说，这部片（包括《长津湖》）还是进化了不少，至少主角突出了（不像以前的战争片，几乎没有主角），细节描述刻画得也多了，真正是一部电影了（以前更像纪录片）。,4.999999999999997,3.0,1.9999999999999973
太好哭了，祖国的强大在于有着无数人的前仆后继,4.981986711868231,5.0,0.018013288131768945
额，这一部感觉有点删节重要桥段的感觉啊。。剧情有几个点不太连贯，不知道是怎么回事。反套路的拍摄手法还是可圈可点的，当观众以为最后志愿军一定能炸掉桥的时候，桥却还是被修好了。但从这个点里面却可以看出当年敌我双方实力有多么悬殊，但志愿军战士还是那么去了，还是那样打了，这或许是电影给我的最大启示吧！为伟大的志愿军战士默哀！,4.999885066217555,3.0,1.999885066217555
成片四星，情感加一星。比前作好，风格统一，叙事完整，群像丰满。几乎全程都在哭~ 每一个牺牲的人物都象征了无数普通又伟大的志愿军战士，他们在关键时刻挺身而出。我看到他们的勇气、坚毅、信仰和饱含深情的爱――对战友、对亲人、对人民、对祖国… 永远铭记先辈们用鲜血和生命换来的和平！,4.99999999999441,5.0,5.590194973592588e-12
为了老段，勉强把第二部也看了。emmmmm,4.2526766237322375,2.0,2.2526766237322375
配乐太满了，而且有些位置用得情绪不对。,3.3972438945569055,3.0,0.39724389455690545
已经流不出一滴眼泪，但不知道叹了多少口气，五脏六腑都要憋爆了。――2022.2.23看完,4.968648594141257,4.0,0.968648594141257
情感饱满，镜头语言实在一般,4.6186868530463805,3.0,1.6186868530463805
桥，那经费不够吗？我看过的书面材料说柱子炸飞后，桥主体从天而降并搭建，没有达到想象中的震撼,3.292596623387309,3.0,0.29259662338730896
珠玉在前,1.9891083128136797,3.0,1.0108916871863203
前面都还好，但最后突然多了一辆车，又6人再次炸桥成功，人家层层布防就这么纸糊的。那个炮弹脱离控制补枪实属画蛇添足，直接摔下去抱着炮弹开枪自爆就完事了。后面20分钟属于强制煽情，挺尬的。说实话观感不如第一部。,1.011686826041554,3.0,1.988313173958446
徐克第二十部。蚌埠住了，这玩意儿要是还不给一星那啥给一星啊。,1.3897424602574122,1.0,0.3897424602574122
实到一人，破防。,1.7470607718243736,4.0,2.2529392281756264
剧情流畅，有点夸张,4.794879233186767,4.0,0.7948792331867667
这盛世如你所愿,4.857188715622483,5.0,0.1428112843775171
比长津湖上半部好一些,4.55964352062684,4.0,0.5596435206268398
太可了，我三年的眼泪都在这2个多小时里流完了――平河死得太惨烈了，余从戎悲壮，唉，要是把吴京片中的武打动作设计减少一点，就更好了,4.998330101019122,5.0,0.001669898980877882
徐克拍战争：费什么话啊，战争的本质不就是打吗，那直接开qiang 吧,4.544470084318874,3.0,1.5444700843188741
6.5分。如果把开头30分钟去掉就更好了这不是主旋律电影的进步，是影视行业在前十年得了“小时代”的病之后的康复阶段。前面塑造空洞，以至于后面几个大老爷的大吼大叫，及格线边缘的视觉水平却不如2009年《风声》的平静收尾台词来的震撼。“因民族已到存亡之际，我辈只能奋不顾身，挽救于万一。我的肉体即将陨灭，我的灵魂与你们同在。敌人不会了解，老鬼，老枪。不是一个人，而且是一种精神，一种信仰。”,4.9999999999960005,3.0,1.9999999999960005
这部从头到尾不是大雪遮眼就是炮火漫天，基本也看不清谁牺牲了。不过随着第七连一个个牺牲，煽情效果还是起来了不少。只不过一想到当年那么多烈士用鲜血换来的新中国，如今却被各样的糟践，就觉得这种电影拍得越多反而越具有讽刺效果。,4.999876063260592,3.0,1.9998760632605919
7连短暂占领水门桥后，远方的陆战一师炮兵用榴弹炮对水门桥进行了轰炸……我就不明白，同样是用美制炮弹炸桥面，为什么在志愿军手上能炸桥，用美国炮轰出来就炸不了桥……总的来说比1好，因为武侠爽片更彻底，伍千里有钛合金腿骨。最后用喷火器烧了伍千里尸体但是温暖了已经冻僵的伍万里的情节设计，我很喜欢，这个是神来之笔。,4.927035009964166,3.0,1.9270350099641664
M屏的热血爷们儿让我满眼的泪水,4.9887603921424155,4.0,0.9887603921424155
IMAX震撼感人,4.9395750090631205,4.0,0.9395750090631205
比上一部有逻辑，有泪点，血量更多。,3.944628321398278,4.0,0.055371678601721985
铭记历史，那些逝去的英雄就永远活着。对于电影剪辑、特效、拍摄什么弃评，很难拼，我不是专业的，只能说隔行如隔山。,4.9996640167424715,3.0,1.9996640167424715
徐克+林超贤就是各种飞和突突突,2.628920822811451,4.0,1.371079177188549
纯电影角度，易烊千玺这个角色完全是败笔，本来已经夸张了的剧情非要以这样的人物为主角实在是不可接受。战斗场面设定花哨得过了。,4.991996580300908,3.0,1.991996580300908
我们想看这段历史的战争片，但又不想看只有战争的战争片。,4.999056643052903,3.0,1.9990566430529029
舍生忘死的进攻 换来了和平的空间 感恩,4.348984534296434,4.0,0.3489845342964344
没经历过战争的我们是幸运的，同时也是脆弱的。,4.963460430796713,4.0,0.9634604307967134
那天，问我们班的小孩想看啥电影，他们居然点了长津湖、战狼和长空之王……不禁感慨现在的小孩真是……这个年纪的小孩不应该点点儿迪士尼，皮克斯的动画嘛！,4.999981548231284,2.0,2.9999815482312844
我的战争片爱好者父亲，主旋律作品精准受众，观影前：给我放长津湖2！我就要看！两个半小时我也要看！观影后：（呆滞）（无语）（一串国骂）耽误我睡觉！（破口大骂持续两周）,4.2572738332396085,2.0,2.2572738332396085
留意了下，片尾打出徐克的头衔是“监制导演”，区别于另外两位的“监制”，也不知道这是不是独创的工种名。单就视觉来看，确实使在上一部的混乱场面中潜隐的场面特质鲜明起来，比如室内的火焰、室外的恶雪，在官能的极端对转中强化肉眼对残肢肆虐的痛的捕捉。流畅的调度设计掩盖住工业置景的假体性，如同沙盘模型般的推演，好几场戏当真使cg笼罩的岩坡炸点装配上了压迫感，难得打出了国产战争戏的些许个性,4.999999999999992,3.0,1.999999999999992
文戏少了许多，战斗画面更加激烈了，令人潸然泪下的点也很触动，明知道会这样发展的剧情，到那个点还是忍不住酸鼻子。这就是钢少气多的人民志愿军吧！,4.99985367112855,3.0,1.99985367112855
还是去看纪录片吧,4.762188743505819,2.0,2.7621887435058188
故事线非常好，超级好看,4.602670356487131,5.0,0.3973296435128688
比长津湖好看：慢了下来，同时放大细节，让一个擦伤、钉子看起来比被轰炸更疼痛，也让情感表达更真挚；战争讲述伴随策略一步步十分清晰，不再是一股脑快速剪辑下的狂轰乱炸。但CG依旧很容易和真实场面辨认，感觉和B站up学了一个月制作出来的效果差不多；抗美援朝却一个朝鲜人都没看到，主旋律和导演意志过强。对于人物，烘托人物关系的“情”不细致、容易疲倦；有人物弧光变化的，例如伍万里对于战争认识――从杀敌到战争人性，但影片强调的“英雄”概念仍在，虽然英雄肉体会亡，但精神高尚永存，最后伍千里的重新出现特别像《大路》里对于无产阶级革命者的诠释。相较之下，美军反而更像“人”，甚至还有类似于《拯救大兵瑞恩》中战前音乐片段的模仿、或不同立场下的战争表述，一瓶酒、一个纪录片片段都显得格外真实。,5.0,3.0,2.0
和爸妈在电视上看了一半，另外一半平板补全服化道太真实了每一位抗美援朝的先辈都是英雄,4.91205397569189,4.0,0.9120539756918902
