影评内容,情感得分,影评分数,差异
上回《战狼2》我列了九宗罪，这回《流浪地球》没有字数限制的话估计能列100个槽点。先抛开各种违反物理规律的弱智设定，单是严重缺位的联合政府、由始至终缺位的美国代表（也是把最不信任人类命运共同体的国家踢出局）、低到令人发紫的违法成本就可以大批特批。2500年的宏大计划，就连撞木星这么大的事情也没个预案，推着个小破球到哪算哪以为是小孩子玩泥巴？你们称赞的硬科幻在我眼中毫无新意，那莫斯完全是复制1968年不朽经典《2001太空漫游》的HAL9000，空间站出舱一段完全是《地心引力》，全片的父子情则完全是《星际穿越》，几乎每个桥段都能在荷里活经典科幻中找到原型。哦，最原创的“道路千万条”的梗，如果是真的我只能为北京交委这糟糕到作呕的文案设计默哀。,4.999988038223423,2.0,2.9999880382234227
我们都活在沟渠之中，但仍有人仰望星空。,4.9059901938944295,5.0,0.09400980610557053
知道为啥那么多小学生，只有韩朵朵脱颖而出可以在全球演讲吗？因为她有心机，知道演讲的时候提领导，我们都是在xxx的领导下进行的这次援救任务。都可学着点吧！,1.2611705148751806,3.0,1.7388294851248194
你们这样引爆木星，有没有考虑过木卫二的感受！！三星可以吗？世界观满分，情感线不及格，人物行动线不稳定，人物群像刻画一塌糊涂，特效水平忽高忽低，演技发挥不稳，屈楚萧加一分，他爹战狼减一分....你猜炸木星这个梗，惹恼多少有基本天文常识的人哈哈哈哈哈,4.997511022562459,3.0,1.9975110225624588
从电影院出来，看见电影里被冻成冰棍的国贸建筑物们，竟然有一种恍如隔世的感觉！,4.474176594787581,4.0,0.4741765947875809
儿子，爸爸死了以后，能不能别再这么二逼了,4.053085669726875,5.0,0.9469143302731249
木星那么可爱，为什么还要炸木星,3.30140163580707,3.0,0.3014016358070699
效果还不错，但总觉得逻辑观点哪里怪怪的??星际穿越是为了拯救人类顺便救了家人，这个好像为了救家人顺便救人类……,4.999992224200039,3.0,1.9999922242000387
忽略科幻的硬伤，拍的算不错了，纯粹加一颗星鼓励一下，发展都是需要一个过程的，希望将来能够有国产的硬科幻。,4.986623147546914,4.0,0.986623147546914
给个鼓励分吧,4.342953324898241,4.0,0.34295332489824126
既然没看都能给差评，那我没看给好评也不过分,1.0152735178575116,5.0,3.9847264821424884
是我看过的最好的中国大片。刘慈欣的小说使剧本的立意和创意拔高了一大截，演员演技都不错，特效也不错。要比很多骗钱的外国大片有诚意的多。缺点也不是没有，从剧本到演员到场景都有，比如每一个推进器内部竟然没有备用核心机要千里迢迢运过去，地球流浪这么宏大的计划竟然没有地球被木星吸引怎么办这样的备案，吴京总觉得像随时掏出枪突突的感觉，地下城像魔幻主题迪斯科舞厅……总的来说还行，值得一看,4.99999999999993,5.0,7.016609515630989e-14
吹战狼我觉得没什么大问题，流浪地球能吹到这程度？此外电影是电影，这句话是没错，但若因为一部电影而催生了一个邪教，那这部电影是不ok的,4.999969534370136,2.0,2.999969534370136
去看之前特别忐忑，生怕不能打5星。看完松了一口气，可以理直气壮给5星，真好！,3.3600367363877335,5.0,1.6399632636122665
道理千万条，好看第一条；剧本不扎实，观众两行泪。,4.932792388686906,3.0,1.9327923886869058
大家都在赞叹电脑特效有多好，我倒觉得特效跟顶尖工作室还是有一定差距的。观众觉得好，是因为电影人终于明白了电脑特效，无论有多逼真，终究只能是一个虚晃，不能是电影视觉的中心。所以这次会有更多的真实道具以及实效在画面中占据的比重更大，电脑特效只是在远处或者画面比重很小的范围内作为一个背景出现，给人更加真实的感觉。相比起来少有的整个画面都是电脑特效的段落就会对比起来让人觉得很突兀。一定要挑毛病，角色当然稍逊，剪辑也是有很多问题，但总体完成度非常高，是比及格还要好的大片了，还是值得鼓励的！,4.999999999999947,4.0,0.9999999999999467
作为一个影视行业的日本导演来说，真的佩服中国科幻电影的制作技术。特效非常非常厉害。日本的话目前可能做不出来这样的电影。但我觉得演员的演戏不像美国灾难电影那样的那么自然。也许还不习惯在绿布上演戏？或者我的听力有问题？反正我希望在日本也上映这部电影，想知道日本人观众的反应。,4.999999999820799,4.0,0.9999999998207993
能做出这么恢宏的硬框架科幻 怎么都还是值得4星鼓励的 下面进入吐槽时间：科幻大架构是挺硬的 但是缺少细节啊 换汤不换药的这么大设定就是一个原汁原味国产煽情片的背景而已。经费都用来做特效了 就没多打赏点儿研究研究台词 特别是韩朵朵广播电台。最要命的 吴京先生扮成啥样 就这台词功底 一张嘴还是当初那个西门金哥啊。,4.999999920993459,4.0,0.9999999209934591
这就是中国媒体盛赞的中国硬科幻开山之作？主角兄妹尤其哥哥的人物塑造非常糟糕，台词差，性格讨人厌。所有角色脸谱化，废戏简直太多了。一个中国军人自作主张的引爆装载着地球文明全部火种的空间站，去协助执行一个一开始被以色列评估成功几率为0%的计划，然后突然就又成功了？这种中国式英雄主义比美国的好不到哪儿去。除了特效，其他负分。,4.999605989265942,1.0,3.999605989265942
问题多，但依然能成为强心剂。毁灭一半生命，漫威要铺垫十年，最后花俩小时讲一半。中国电影里，一句话、抽个签就可杀死?，然后全人类没有留下任何后遗症。人的心理，没有跟上地球毁灭的节奏。,4.999997736653021,4.0,0.9999977366530208
特效很棒，美而绝望。但作为电影，故事情节单薄，没有冲突点，所以整个片子一点都不吸引人，就是看到中途离场也好奇后面发生了什么那种。人设也非常奇怪，哥哥妹妹父亲外公，没有一个正常人，制造的笑点让人笑不出来，为煽情而煽情，但又煽不到位，可能是史上耗资最大的春节回家宣传片。,4.999989393273802,2.0,2.999989393273802
色香味都ok的年节大菜，但吃到最后觉得油盐太重既腻又J。产业意义高于其他所有价值，在这一点上与它并提的的确应该是“药神”。京味重到无法忽视的地步，而这个角色到最后又还真是非他莫属的感觉，飞上太空，战狼依旧是战狼，家国永驻心间，一己之躯逆天改命！,4.997797124534895,3.0,1.9977971245348947
过年的时候都被刷爆了，一直没看，今天真是当一个好电影看的，结果tm什么玩意，科幻不等于荒诞好吗，末日来临了一堆演员表演、台词都tm在玩过家家呢？你知道用不痛不痒的拙劣演技来展现末日的恐慌和悲怆、用看似一本正经的光荣口号来硬凑气氛和烘情感，有多尴尬吗？,4.999997591987253,1.0,3.9999975919872526
我很纠结这部电影应该给三星还是四星。它好的地方在于，对好莱坞灾难片的套路学得已经比较像，无论是技术、影像，还是编剧，都比较完整地实现了常见的套路。缺点恰恰也在于，因为它从里到外都是套路化的，所以原著中比较深刻、意味深长的部分（虽然我对原著很失望，但它确有比较有意思的一面），即极端危机环境对人性的改变（绝望的社会气氛、家庭和爱情的变化），在电影中消失殆尽，取而代之的是现实社会中人们习以为常的伦常感情、群体认同。这部电影里表达的那些“正能量”，在类型片中俯拾皆是，毫无独到之处。这就是一部还不错的类型电影的两面。,5.0,4.0,1.0
质量超出我预期，这个算是提前把全频带阻塞的梗给用了？记得小说没有空间站挽救全局的情节啊。,4.9366809489342405,4.0,0.9366809489342405
好莱坞灾难片加安全驾驶宣传片。细节填充意识很好，但是，让观众看到最后脑子里都是“道路千万条，安全第一条，驾驶不规范，亲人两行泪”是想干啥。撞车扣三分，压挡板扣十二分，最后开空间站都不忘捆安全带，在安全驾驶界是中国电影里程杯吧……,4.818464243671186,3.0,1.818464243671186
情节和逻辑说不通的地方太多了，对话基本靠吼。最可怕的是个人情绪决定世界命运，我可不想把命交到这些人手中……,4.999910479233256,2.0,2.9999104792332556
一分给特效。这部电影就像中国的大城市，华丽恢弘，没有灵魂的高级废墟。,4.996167341468767,1.0,3.996167341468767
客观讲四星，高起点加一星鼓励！后来的想蹭热度圈钱的家伙们可要想清楚了！,3.694415907021337,5.0,1.305584092978663
一个不会投资的演员不是好的武打明星。,4.9511855062079215,4.0,0.9511855062079215
真特么垃圾，怎么得这么高分的,1.5357719999746093,1.0,0.5357719999746093
5-6分的水平。抛开所有逻辑和价值判断，影像水准和台词水准严重不符。影像一般，太多近景和特写，仿佛摄像机后退1米都不够钱。剧本和台词太差了，人物扁平而模糊。中文演员的演技和念白都不及格。吴京一张嘴我就崩溃，从声线开始就有问题。希望中国导演能早点儿学会用画面哪怕是字幕交代背景。最不明白刘慈欣的粉丝为何群情激昂地吹此片，明明跟原著只有半毛钱关系。,4.999946439957394,3.0,1.9999464399573936
科幻bug放一边，mike隋的角色是在给强奸犯洗白吗？关进监狱理由千千万，非得加一句“前天是那女孩主动的”。【我是一个强奸犯，我是一个外国人，但我有一颗中国心。】？？？,3.1939048319855443,2.0,1.1939048319855443
感觉里面的脂人的演技像是人工智能在模拟人类情感。。,4.99756022232433,2.0,2.9975602223243296
唯有牺牲多壮志，敢叫日月换新天,2.9576892155023704,5.0,2.0423107844976296
最佳故事片证明了某国电影烂到的程度,2.7422274942717464,2.0,0.7422274942717464
"给赛博朋克的地下城加一星！ 
导演讲故事的能力有待加强嘛，前一个小时节奏失控，想讲的事情太多，小高潮前的铺垫都省了，仿佛一场百米冲刺半决赛。而且用Stereotype来做笑点可一点不好笑，开枪自尽前说句日语还不够，硬要提句味增汤仿佛怕观众不知道是日本人要自杀，真是尴尬至极的恶趣味。",4.999883322311547,3.0,1.9998833223115469
本质上就是一部常规三流好莱坞科幻/灾难类型片的拿来主义舶来品，不过套了一个中国背景的壳。整体偏灾难片的剧作，说教与煽情一个不少，没什么新鲜同时也循规蹈矩基本上完成了任务，特效大概能看但细节太粗糙，不能瞄的太细致，两个小时的全CGI镜头看下来眼睛还是挺累的。其实更佩服的是吴京独到具有前瞻性的投资眼光，不知道这次又能赚几个亿，专心做制片人吧，福布斯富豪榜榜上有名完全可期。,4.999999931289553,3.0,1.999999931289553
史诗感，科幻、灾难、恐怖、悬疑（空间站线），每一个特点各有作用，不在没有意义的情节上浪费时间。说是里程碑影片绝对不为过。,4.880397391165109,5.0,0.11960260883489138
国产科幻到这一步诚意很足了。挺感动的，加一分，吴京演技一直一般，减一星，建议他用配音，小演员和李光洁大头cp很好，吴孟达自不必说。不是物理学家天体物理学家什么的专业上不知道槽点。小梗挺多的，稚嫩但是不错，加一星。推荐。,4.999909739207064,5.0,9.026079293583678e-05
有很多瑕疵，不过真的很喜欢。,4.592655739449619,4.0,0.5926557394496186
趁着酒劲，泪眼朦胧的看完，元年！！是TM元年。只有一个小细节问题，能点燃木星吗？就散逸大气那么点氧气，而且辣么近的俘获距离里，燃烧是喷射推力多，还是爆燃烧了地球？这个应该大学物理可以算出来,4.998869187418977,5.0,0.0011308125810227665
营销的骗局,2.826417393778056,2.0,0.8264173937780561
作为硬科幻电影，各种bug各种不严谨，把科幻拍成言情，除了特效在国产中属于上乘，其他没有任何部分是及格的。为表鼓励给三星。★★★,4.997882750908433,3.0,1.997882750908433
吴京携一家老少实力拯救地球，直男癌告诉你孩子的孩子还有孩子，他们会生的。,4.999775293675496,1.0,3.999775293675496
不能因为有一群白痴也喜欢它，所以就故意唱反调以显示自己的清高，结果是既侮辱了影片也羞辱了自己，把自己降到跟那群白痴一个级别了。好就是好，缺点当然有，但即使拿去好莱坞上映也不会矮人一等。科幻是理科人的浪漫，带着地球去流浪，可谓是科幻浪漫的极致了。,4.999997960221714,5.0,2.039778285833904e-06
仿佛听了两个钟头的土鳖广播剧 ,4.979375259929726,1.0,3.979375259929726
真他妈好看，字幕出来的时候想起立鼓掌。比起老美狭隘的个人英雄主义，中国人真是有大爱的，打破隔阂，中俄日韩全世界一家亲，带着地球一起逃亡这种路数老外一万年也想不到。片子本身四星，但冲给中国科幻迷的这份激动必须五星！,4.999999996372449,5.0,3.6275507042660138e-09
3.5。特效很不错，末世场景的营造有戳到我，但故事就很一般吧，也挺套路的……,4.997350377980704,4.0,0.9973503779807036
小米加步枪撸起袖子加油干。因为几个男演员的顺眼加一星。对女性角色的安排非常无语。木星作为最大反派没有给景色特写是败笔。,4.999002661884337,4.0,0.9990026618843366
煽情，公器私用，不喜欢,3.083274829153787,1.0,2.083274829153787
为啥所有角色都那么假呢？,2.087613821632976,2.0,0.08761382163297604
我赶在首映去看的，和别人在点映时看到的，应该是同一部《流浪地球》吧？……说正经的：确实是启航之作，合格了！――不容易，真的不容易！可遗憾也扎眼：好莱坞的手法都有，但好莱坞的大片不会有这么多刻意；大刘的精神内核也有，但大刘的叙事不会有这么冲动。此外，领航空间站的最后时刻，或许更适合对应上大刘《全频带阻塞干扰》里万年风雪号上的米沙（庄宇）的复杂情绪，但在屏幕上展现出来，却更接近老王《拉格朗日墓场》（《奔向太阳》）里小飞蛾号上的鲁刚的单纯情怀。最后，记得从成名作《流浪地球》刊发到代表作《三体》连载，大刘用了六年；那么，从启航之作《流浪地球》开始，我们又需要多少年呢？还是真心期待吧。,5.0,4.0,1.0
电影版三体的有益尝试。的确是中国科幻片第一次尝试如此宏大的场景与叙事，并且做到了。,4.9990722802880985,4.0,0.9990722802880985
整部电影尬到打鸣，不知道怎么能浪费两个小时讲一个既不深刻也不精彩更经不起推敲的科幻故事。最后韩朵朵长啥样的人设放在这部里的作用是不是当燃料被人点燃被人骂？,4.679824394930186,2.0,2.6798243949301863
cinematically and humanitarianly failing.,2.790713834039467,2.0,0.790713834039467
超出预期，国产科幻电影里程碑式作品，算是在一片荒地里长出了一株鲜活的幼苗。成功的原因首先是依托于大刘扎实的硬科幻文本，我们仍然能明显感到大刘的典型左派直男表达，所以这更像一部刘慈欣电影而非郭帆电影或吴京电影。第二个成功点在于工业上的长足进步，基本经受住了重特效的考验，许多视觉想象都令人惊喜。第三是类型元素的充分满足，后半段每个五分钟一个小高潮，偶尔插科打诨缓解紧张氛围，节奏处理的非常好，同时以父子关系为情感主线引发共情。虽然也有几处配音、台词这类的小瑕疵，不过总体无伤大雅。刘启面对土星灵光闪现的时刻我居然脑补出了罗辑的形象，刘慈欣在黑暗命运的背景下总还是对人性寄予了浪漫的希望。,5.0,5.0,0.0
还以为Ai被伏特加砸到会骂一声：wcnm,1.0385552947345458,2.0,0.9614447052654542
有生之年系列。,4.733201888520126,4.0,0.7332018885201261
刷了两遍，这不是科幻，这是玄幻啊！这么多去科学的设定，麻烦编剧好好改改剧本。两星都给后期。这两年吾国彻底走上了迷恋超级英雄式不归路，拯救地球拯救宇宙，核心人物还是几个毛头小孩。一些台词和口号喊得我满屏尴尬，中间还非得插一些海草舞这种桥段，最糟的还有乱七八糟的剪辑。救命??,4.999999907960014,2.0,2.9999999079600137
不太懂打低分的朋友们是以啥标准评分的？这个丢在中国商业片里所有纬度都能有4分了吧？剧情没很扯呀，就是正常动作片水准。不是很硬核科幻，其实是科幻元素的动作／灾难片的套路（当然对于中国已有的科幻来讲确实是非常硬核了。。。吴京真的出戏，而且我发现他台词和涛涛也好像啊，有气无力的哈哈哈哈，最后那一瞪眼真的涛本涛！女性角色一如既往的鸡肋但。。男主也如此沙雕我几乎都不忍心吐槽了??♀?。,4.999998273163094,4.0,0.9999982731630936
三星半，优点：国产首部科幻大片非常硬核，全片基本被动作戏和特效大场面填满；有些镜头画面很华丽，BGM够磅礴大气；绝望的灭世感与拯救地球的高燃混搭出奇妙的观影感受。缺点：前半部分剧情推进过快，叙事琐碎会影响普通观众的理解和入戏感；新演员的演技有待磨练；很多台词和笑点很尬～总体算不错,4.999999999999989,4.0,0.9999999999999893
2.5分四舍五入三星吧，算我支持国产科幻。要说实话，这部科幻片实在太难看了，它不能称其为一部电影，整体节奏、剧情、人物设定、对话、独白都充满了外行风格，这不像是电影人拍的电影，编剧导演添加了太多他们自认为俏皮、可爱、年轻、煽情的元素，我甚至能够想象到他们的拍摄模式，“这些调料不错，往里面加，那些调料不错，加进去”，还真是杂乱无章，幼稚的可笑。一部科幻电影的好坏，并不是取决于你用了多少特效，有时候一个场景一个镜头一个设定，就能把科幻片的特效风格带出来，关键是你对电影的理解和电影的结构，连基本的东西都做不好，走都没走稳，还是别跑了,4.9999994085617665,3.0,1.9999994085617665
国产电影工业水平真心可以，但剧本和演员真的是降智打击,4.991753273346937,2.0,2.991753273346937
不管你们怎么吹，我就是觉得很一般，前半集一片白雪，后半集一片火光，团结一心修发动机，吴京连人带卫星主动牺牲，渲染亲情，传递正能量。到头来只记住一句话：“道路千万条，安全第一条，行车不规范，亲人两行泪”。,4.999944652213134,3.0,1.9999446522131343
emmm，低配版的hal9000，最后结尾和龙珠一样，“告诉琪琪对不起”那一段。什么玩意…不要把人类大爱局限起来好么？但概念还行8多给一星,4.987655520193616,3.0,1.9876555201936164
3.5，国产科幻及格。赢在故事，科技细节粗糙，台词生硬出戏和煽情过度扣分。,3.8598119207139736,3.0,0.8598119207139736
科幻我不懂，这个类型我也不喜欢，好像从没打过五星，但人物和情感没什么问题。就个人而言，能理解褒赞，理解不了攻击。,4.9797071884985975,3.0,1.9797071884985975
特效不错，美术不错，配乐不错，大刘的原著不错。剩下的都是陈芝麻烂谷子。我的双腿在不住的颤抖，因为我是一名初中生天才??????,4.999953325591468,3.0,1.999953325591468
步子迈大了容易扯蛋！什么硬科幻...奇幻还差不多！特效视觉无法代替故事与人物，矛盾、危机情感都硬生生的靠台词来表达，每个人物之间的关系建立都薄弱的跟电影里塌个没完的地球似的。大荧幕上人物的近景是带入共情的关键点，可是不仅带了个头盔还狂风暴雪，看不清楚脸，还有在喊着想回家的时候竟然切了个大全景，呃...最后妹妹那段慷慨激昂的号召之后，我就只能一直挠脑袋，这是在演什么？,4.999999994804285,2.0,2.999999994804285
视觉 架构 ，爆炸级别的震撼 ！ 就几段台词尴尬得我想掀桌……差点毁了整部片子啊幸好持续时间不长。还有收音是怎么回事现场是请不起录音师这个角色吗……,4.996153527754734,5.0,0.0038464722452662414
原著具有讽刺意味的结局被moss一句“让人类保持理性是一种奢求”所带过，但电影的改编则更有人情味。不过过度煽情近乎矫情了。,4.999905619817081,4.0,0.9999056198170813
特效真实，在中国科幻电影范畴实数佳品。但是，电影中的地球已经千疮百孔，执意带着这样的家园移民新栖息之地，让人不免觉得“流浪地球”计划过于情绪化了，缺乏科学的判断与取舍。纵观人类历史，无数次的大规模迁徙，无不在证明着：更小的成本付出，更大的回报收益，更高性价比（资源更好）的生存环境，更可能是人类发展的选择方向。,5.0,3.0,2.0
中国终于有科幻电影了，撇开一些瑕疵，大场面壮观，已经算国际级了。少一点煽情会更好，人心的善恶展现不足。但是还是要赞赞赞。,4.999999986341496,4.0,0.9999999863414963
"场面大，特效炫，不错，中国拍出来了，但挡不了节奏混乱,无美感的镜头连接和长时间没有停顿激烈场面造成的视觉疲劳，当然，叙事不清是意料之中的，格局也狭隘，中国电影什么都逃不过两辈人恩恩怨怨么，这tm是拯救地球的科幻大片啊，真的受不了危难高压时候小女孩儿工作者在全球广播中哭是什么鬼，吴京和儿子的线仍然烂俗，还有为什么影片中一遇着啥事儿大家就冲动内讧??还真符合中国人的性格呢??更接受不了的是基本逻辑问题，当吴京收到联合国消息说这个计划成功几率为零的时候?人的第一反应不应该问为什么吗?得有真正不可实现的难点才能说成功率为零啊？主角哪儿来的盲目自信当作没听见一样??我看到的时候真的细思极恐，要是保卫我们的人真那么无脑......",4.999999999578709,2.0,2.9999999995787094
多次拿女性胸部玩梗就是很不适,2.882949664929887,1.0,1.8829496649298871
一个年轻貌美的妈妈为了一碗面当着自己小孩的面被一个流浪汉糟蹋… 想出这种剧情的人指定是脑子有点问题,4.956421640314467,3.0,1.956421640314467
没那味了，后面强行升华，些许厌倦。,4.8996834947678485,3.0,1.8996834947678485
开场尬到爆啊，逻辑混乱，推理小儿科啊，结局强行升华啊，总之是一部能看但不推荐的平平无奇的电影。,4.998007966975824,3.0,1.9980079669758242
刘昊然很帅，但是护士姐姐被打和36D那里真的让我生理性不适,4.688650373212861,4.0,0.6886503732128606
不能忍强殴女护士！！！,1.3028248508849392,3.0,1.6971751491150608
全剧136分钟：110分钟的跑路+15分钟的父女故事10分钟的推理+1分钟的广告。,4.9837991654411695,2.0,2.9837991654411695
无语，这个夹带私货好多，好多地方尬的一身鸡皮疙瘩，就是普通的商业片。,4.243214249056882,3.0,1.2432142490568818
懂了，Q是圣殿骑士团日本分部,4.331767270704585,1.0,3.331767270704585
低俗谄媚粗制滥造，连起码的诚意都没有，推理全靠奇情轶闻，笑点东拼西凑，初一起了个大早去看电影，刷抖音睡懒觉不香吗。为了长泽雅美，努力多挤了1星，滚蛋吧，还唐探宇宙，不要太膨胀，呕。,4.9766383510062155,2.0,2.9766383510062155
整个片子如同看了日本文旅宣传片和泰拳的宣传片，中国元素太少了。无厘头搞笑风格，拉低前两部作品的悬疑推理能力。总之，很失望。,4.998057013680775,3.0,1.998057013680775
煽情的那部分是认真的？？？好手好脚的妈，为了给女儿一碗面去跟流氓睡，为了给女儿一块蛋糕去偷去抢，被抓了之后病死在监狱？从此女儿决心对抛妻弃女的父亲复仇？？？这是什么狗血剧情。什么年代了，还这么三观不正。,2.9516487148370696,1.0,1.9516487148370696
当女性在遮蔽的裹尸袋里被一群男性毒打的片段出来引得全场哄堂大笑的时候 我只能感到悲伤 看吧 这就是你们身处其中的男权社会 不知道陈思诚这是刻意安排吗 为什么同样身为男性的王宝强也在裹尸袋里却不安排他成为暴力的受害者？这可是面对可能亿万观众的屏幕在传递的男性暴力…我真的觉得这位油腻导演有必要出来解释一下,4.999999999931335,1.0,3.999999999931335
无底线的烂梗真的很无聊,2.9946844444000833,2.0,0.9946844444000833
